"Attribute","Description","Valid Values","DependsOn","Required","Parent","Source","Validation Rules","columnType","Format","Minimum","Maximum","Pattern"
"psoriasisType","General type classification of psoriasis disease manifestation.","erythrodermic, guttate, inverse, plaque, pustular","",FALSE,"","","","string","","","",""
"ageDiagnosis","Age at which subject was diagnosed with `diagnosis`. If providing this value be sure the unit matches that used for `age`.","","",FALSE,"","","num error","number","","","",""
"age","Age at which subject was enrolled in study or age at corresponding visit and data collection event. If value unknown, enter '-1'.","","",TRUE,"","","num error","number","","","",""
"ageUnits","The unit of measure used for `ageEnrollment` and `ageDiagnosis`","months, years","",TRUE,"","","","string","","","",""
"sex","A textual description of a person's sex at birth.","female, intersex, male, unknown","",TRUE,"","","","string","","","",""
"height","Standing height of subject.","","",TRUE,"","","num error","number","","","",""
"race","A textual description of a person's race.","American Indian or Alaska Native, Asian, Black or African American, Hispanic, Mixed Race, Native Hawaiian or Other Pacific Islander, White, other, unknown","",FALSE,"","","","string","","","",""
"ethnicity","The ethnicity of a person.","Hispanic or Latino, Not Hispanic or Latino, unknown","",FALSE,"","","","string","","","",""
"heightUnits","Unit of measure of value provided for `height`.","centimeters, feet, inches, meters","",TRUE,"","","","string","","","",""
"weight","Weight of subject. If value unknown, enter '-1'.","","",TRUE,"","","num error","number","","","",""
"weightUnits","Abbreviated unit of measure of value provided for `weight`.","g, kg, lb, oz","",TRUE,"","","","string","","","",""
"comorbidities","Any diseases or medical condition that is simultaneously present in addition to `diagnosis`.","Hashimoto's Thyroiditis, autoimmune thyroid disease, cardiovascular disease, diabetes, inflammatory bowel disease, multiple sclerosis, other, psoriasis, psoriatic arthritis, pulmonary disease, rheumatoid arthritis, systemic lupus erythematosus","",FALSE,"","","list like error","string_list","","","",""
"diabetesType","Type of diabetes mellitus.","gestational, type 1, type 2, unknown","",FALSE,"","","","string","","","",""
"VIDA","Vitiligo Disease Activity Score, a six-point scale that evaluates the activity of vitiligo","","",FALSE,"","","","string","","","",""
"VASI","Total body Vitiligo Area Severity Index, a measure of the percentage of vitiligo involvement across the body calculated in terms of hand units.","","",FALSE,"","","","string","","","",""
"VETI","Vitiligo Extent Tensity Index measures the extent of vitiligo by a numerical score and combines analysis of extensity and severity of vitiligo to produce a constant and reproducible number.","","",FALSE,"","https://doi.org/10.5826/dpc.0404a18","num error","number","","","",""
"PASI","Psoriasis Area and Severity Index, is a measurement of the discoloration, thickness, scaling, and coverage of psoriasis plaques.","","",FALSE,"","","","string","","","",""
"CDASI","Cutaneous Dermatomyositis Disease Area and Severity Index, is a measurement used to characterize cutaneous dermatomyositis severity.","","",FALSE,"","","","string","","","",""
"inputCellCount","An estimate of the number of cells expected to be sequenced in a library. Software that process single-cell sequencing data often include options for users to specify this value to improve processing results.","","",TRUE,"","","int error","integer","","","",""
"totalReads","Total number of reads sequenced from the library.","","",TRUE,"","","int error","integer","","","",""
"FACSPopulation","A description of the marker gating strategy used to derive the population cells with FACS.","","",TRUE,"","","","string","","","",""
"cellType","The cell type name from Cell Ontology for the corresponding CL identifier.","","",FALSE,"","","","string","","","",""
"userDefinedCellType","User-defined label of a cell type. Contributors are provided this option to use preferred or custom cell type labels that may vary from options and standards set by Cell Ontology.","","",FALSE,"","","","string","","","",""
"krennInflammatory","A standardized, semi-quantitative measure of the degree of inflammatory infiltrate in synovial specimen. This is one of three measures used to derive the Krenn Synovitis Score (KSS) which is a histological scoring system used to quantify inflammation in synovial tissue biopsies, particularly in the context of inflammatory arthritis like rheumatoid arthritis. If value unknown, enter '-1'.","","",FALSE,"","https://doi.org/10.1111/j.1365-2559.2006.02508.x","num error","number","","","",""
"krennLining","A standardized, semi-quantitative measure of the degree of hyperplasia/enlargement of the synovial lining layer of synovial specimen. This is one of three measures used to derive the Krenn Synovitis Score (KSS) which is a histological scoring system used to quantify inflammation in synovial tissue biopsies, particularly in the context of inflammatory arthritis like rheumatoid arthritis. If value unknown, use '-1'.","","",FALSE,"","https://doi.org/10.1111/j.1365-2559.2006.02508.x","num error","number","","","",""
"krennStroma","A standardized, semi-quantitative measure of stromal cell density of synovial specimen. This is one of three measures used to derive the Krenn Synovitis Score (KSS) which is a histological scoring system used to quantify inflammation in synovial tissue biopsies, particularly in the context of inflammatory arthritis like rheumatoid arthritis. If value unknown, enter '-1'.","","",FALSE,"","https://doi.org/10.1111/j.1365-2559.2006.02508.x","num error","number","","","",""
"krennSynovitisScore","The Krenn Synovitis Score (KSS) is a histological scoring system used to quantify inflammation in synovial tissue biopsies, particularly in the context of inflammatory arthritis like rheumatoid arthritis. If value unknown, use '-1'.","","",FALSE,"","https://doi.org/10.1111/j.1365-2559.2006.02508.x","num error","number","","","",""
"datasetStatus","A categorical label indicating the status of an ARK Portal dataset. This is applied to improve downstream management of datasets as well as various ETL workflows.","deprecated, released, test, under peer review, unreleased","",TRUE,"","","","string","","","",""
"sampleProcessingBatch","A label indicating batching of sample processing or preparation that occurs prior to data collection.","","",FALSE,"","","","string","","","",""
"dataCollectionBatch","A label indicating batching that occurs during data collection, e.g., collecting data across multiple days.","","",FALSE,"","","","string","","","",""
"metadataStandards","Metadata standards used to generate the metadata","ARK data model, user-defined","",FALSE,"","","","string","","","",""
"skinSunExposure","For skin-based biospecimen, this attribute indicates whether the sample was collected from an anatomical site that does or does not receive routine sun exposure.","not sun exposed, sun exposed","",FALSE,"","","","string","","","",""
"sequencingSpikeIn","Pre-made sequencing libraries may be added to your sequencing run to improve sequencing results. If such a 'spike-in' library was used, this attribute specifies the name of the library and the percentage of the spike-in library used in the sequencing run.","","",FALSE,"","","","string","","","",""
"librarySpikeIn","Pre-made collections of nucleic acid fragments can be added to samples during the library construction process to improve downstream quantification and statistical analyses. If such a 'spike-in' was used, this attribute specifies the name and manufacturer of the spike-in.","","",FALSE,"","","","string","","","",""
"readLength","The number of base pairs (bp) sequenced for reads in a fastq file.","","",FALSE,"","","int error","integer","","","",""
"AMP RA/SLE","Accelerating Medicines Partnership Rheumatoid Arthritis and Systemic Lupus Erythematosus. Is a valid value for 'program' that triggers conditional dependencies for additional attributes.","","programPhase",FALSE,"","","","","","","",""
"plateID","An identifier assigned to a multi-well plate. Certain data types and assays profile samples using multi-well plates. Knowing which samples were profiled on each plate is important for establishing sample provenance, finding the right data files for a specific set of samples, as well as downstream exploratory data analysis and QC work particularly regarding identification and correction of batch effects.","","",FALSE,"","","","string","","","",""
"processedDataType","A label used for file annotations to provide a brief description of the processed data file.","barcode counts, differential expression results, epigenomic peaks, gene counts","",FALSE,"","","list like error","string_list","","","",""
"eventCount","The total number of events detected and captured in the corresponding FCS file. In cytometry, an event corresponds to particles detected and measured by the instrument. This number corresponds to the number of rows in the FCS file and is expected to be a whole integer number.","","",FALSE,"","","int error","integer","","","",""
"notes","Please use this attribute to captured pertinent details not otherwise captured. This is an unstructured text entry, please be concise.","","",FALSE,"","","","string","","","",""
"species","The genus species of sample or subject origin.","Homo sapiens","",TRUE,"","","","string","","","",""
"treatment","A short descriptive label indicating what experimental treatments have been applied to a biospecimen before data capture. Please include the word 'control' to indicate specific treatments that are intended to serve as a control group.","","",TRUE,"","","","string","","","",""
"treatmentTimepoint","Where applicable, specify the timepoint relative to treatment to distinguish different sets of samples that have undergone the same treatment but for different lengths of time. REQUIRED: please specify the unit of time, e.g., secs, mins, hrs, days, etc.","","",FALSE,"","","","string","","","",""
"slideID","A distinct label or name, unique within an experiment, assigned to an imaging slides.","","",TRUE,"","","","string","","","",""
"altSampleID","An alternate identifier for a sample. With some assays there can be default or alternate sample identifiers entered into the data collection software. If you will be uploading data collected with an alternate identifier please provide that here. In some cases, the ARK BDM team will use this field to capture original but out-dated identifiers for samples.","","",FALSE,"","","","string","","","",""
"sampleCollectionBatch","A label indicating batching of sample collection or experiment execution that occurs prior to data collection.","","",FALSE,"","","","string","","","",""
"associatedAccession","This is a File and Dataset annotation attribute indicating additional accessions (i.e., unique identifiers) associated with the data when the data has also been submitted to or can be found in other repositories such as GEO, SRA, dbGaP, etc.","","",FALSE,"","","list like error","string_list","","","",""
"percentCellViability","A measure of the proportion of viable cells within a cell suspension. Scale is 0-100.","","",TRUE,"","","inRange 50 100 error","integer","","50","100",""
"sequencingSaturation","A measure of the fraction of library complexity that was sequenced in a library. This metric quantifies the fraction of reads originating from an already-observed UMI. More specifically, this is the fraction of confidently mapped, valid cell-barcode, valid UMI reads that are non-unique. Scale is 0-1.","","",FALSE,"","https://kb.10xgenomics.com/hc/en-us/articles/115005062366-What-is-sequencing-saturation","inRange 0 1 error","number","","0","1",""
"publicationSynID","The synID of the corresponding Synapse entity that stores metadata about the publication. This is used to differentiate publication-specific files, often consisting of level 4 processed data and expanded subject metadata, in a publication dataset that also includes raw or minimally processed files from experimental datasets. This provides an easy way to distinguish and select for the publication-specific data from which the research findings were derived. When this attribute is used to annotate a Dataset it serves as a way to directly link the Dataset entity with the publication metadata stored in Synapse.","","",FALSE,"","","regex search ^syn[0-9]{8} error","string","","","","^syn[0-9]{8}"
"associatedDataset","The synID of a Dataset entity. This serves to link other Synapse entities to Dataset entities. When used to annotate a publication Dataset this attribute should include the synID for an experimental Datasets from which the publication data was derived. Multiple synID can be specified using a comma-delimited list.","","",FALSE,"","","list like::regex search ^syn[0-9]{8} error","string_list","","","","^syn[0-9]{8}"
"custom10xProbeSetSynID","If custom modified probe sets were used for collecting 10x Chromium Flex scRNA-seq data, then the probe reference files should be grouped as a zip or tar archive and uploaded as metadata. This attribute links the experimental data back to the probe set archive file via a synapse ID.","","",TRUE,"","","regex search ^syn[0-9]{8} error","string","","","","^syn[0-9]{8}"
"targetPanelSynID","In most cases an accompanying metadata file should be provided that details information about the targets profiled in the experiment. This attribute links experimental data files to the target panel metadata via the synapse ID of that file.","","",TRUE,"","","regex search ^syn[0-9]{8} error","string","","","","^syn[0-9]{8}"
"datasetDescription","A Dataset-specific attribute specifying the synID of the folder that contains a wiki write-up of the dataset description. This wiki content will be surfaced on the ARK Portal frontend site.","","",TRUE,"","","regex search ^syn[0-9]{8} error","string","","","","^syn[0-9]{8}"
"DOID","Disease ontology identifier associated with `diagnosis`. Attribute values are applied by ARK Portal data managers.","","",TRUE,"","","regex search ^DOID error","string","","","","^DOID"
"BRENDA","BRENDA Tissue and Enzyme Source Ontology ID (BTO) corresponding to the `biospecimenType`. Attribute values are applied by ARK Portal data managers.","","",TRUE,"","https://bioportal.bioontology.org/ontologies/BTO","regex search ^BTO error","string","","","","^BTO"
"year","Year (YYYY) in which the paper was published.","","",TRUE,"","","regex search [1-2][0-9]{3} error","string","","","","[1-2][0-9]{3}"
"PMID","PubMed(R) Identifier","","",TRUE,"","","regex search ^PMID error","string","","","","^PMID"
"ImmPortAccession","Accession to corresponding information in ImmPort.","","",FALSE,"","","regex search ^SDY error","string","","","","^SDY"
"cellOntologyID","Cell Ontology CL identifier that best describes a biopsecimen used to generate data, e.g., CL:0000084 for T cell.","","",FALSE,"","","regex search ^CL: error","string","","","","^CL:"
"PMCID","Pubmed Central Identifier, formatted as a compact URI string that will automatically resolve into a URL based on the Synapse bioregistry; e.g., pmc:PMCxxxxxxxx","","",FALSE,"","","regex search ^pmc:PMC[0-9]{8} error","string","","","","^pmc:PMC[0-9]{8}"
