"Attribute","Description","Required","Valid Values"
"Component","A high-level attribute grouping variable.",TRUE,""
"program","Name of the funding program that supported the generation of data and associated files",TRUE,"AMP RA/SLE, AMP AIM"
"programPhase","A label noting which AMP RA/SLE program phase generated the data.",TRUE,"I, II"
"project","",TRUE,"RA, SLE"
"associatedDataset","The synID of a Dataset entity. This serves to link other Synapse entities to Dataset entities. When used to annotate a publication Dataset this attribute should include the synID for an experimental Datasets from which the publication data was derived. Multiple synID can be specified using a comma-delimited list.",FALSE,""
